name,year,citation,snippet,is_real,source,url
Jadu Gopal Chakravarthy (Dead) After ... vs Pannalal Bhowmick And Ors,1978,(1978) Supreme Court of India,Supreme Court judgment. Query category: property dispute land acquisition.,True,indiankanoon.org,https://indiankanoon.org/docfragment/477701/?formInput=property%20dispute%20land%20acquisition%20%20doctypes%3A%20supremecourt
Bikramjit Singh vs The State Of Punjab,2020,(2020) Supreme Court of India,Supreme Court judgment. Query category: writ petition habeas corpus.,True,indiankanoon.org,https://indiankanoon.org/docfragment/10807134/?formInput=writ%20petition%20habeas%20corpus%20%20doctypes%3A%20supremecourt
Internet Freedom Foundation v. State of Karnataka,2021,(2021) 7 SCC 209,"Petition challenging electoral bond scheme transparency, filed under Article 32 of the Constitution.",False,synthetic-researcher-generated,N/A
Hamsaanandini Nanduri vs Union Of India,2026,(2026) Supreme Court of India,Supreme Court judgment. Query category: constitutional validity fundamental rights.,True,indiankanoon.org,https://indiankanoon.org/docfragment/58466692/?formInput=constitutional%20validity%20fundamental%20rights%20%20doctypes%3A%20supremecourt
Ajay Kumar Choudhary vs Union Of India Thr Its Secretary & Anr,2015,(2015) Supreme Court of India,Supreme Court judgment. Query category: article 21 right to life liberty.,True,indiankanoon.org,https://indiankanoon.org/docfragment/8766447/?formInput=article%2021%20right%20to%20life%20liberty%20%20doctypes%3A%20supremecourt
Ravindra Ramchandra Waghmare vs Indore Mun.Corp.& Ors,2016,(2016) Supreme Court of India,Supreme Court judgment. Query category: property dispute land acquisition.,True,indiankanoon.org,https://indiankanoon.org/docfragment/121065383/?formInput=property%20dispute%20land%20acquisition%20%20doctypes%3A%20supremecourt
Rural Development Society v. State of Tamil Nadu,2009,(2009) 6 SCC 2,"Petition challenging anti-defection law interpretation, filed under Article 32 of the Constitution.",False,synthetic-researcher-generated,N/A
Surinder Singh Deswal @ Col. S. S. Deswal vs Virender Gandhi,2019,(2019) Supreme Court of India,Supreme Court judgment. Query category: criminal appeal conviction sentence.,True,indiankanoon.org,https://indiankanoon.org/docfragment/172085988/?formInput=criminal%20appeal%20conviction%20sentence%20%20doctypes%3A%20supremecourt
Prathvi Raj Chauhan vs Union Of India,2020,(2020) Supreme Court of India,Supreme Court judgment. Query category: article 21 right to life liberty.,True,indiankanoon.org,https://indiankanoon.org/docfragment/31336209/?formInput=article%2021%20right%20to%20life%20liberty%20%20doctypes%3A%20supremecourt
National Farmers Welfare Association v. Ministry of Finance,2005,(2005) 9 SCC 183,"Petition challenging arbitrary internet shutdowns in conflict zones, filed under Article 32 of the Constitution.",False,synthetic-researcher-generated,N/A
Jharkhand State Housing Board vs Shri Didar Singh,2018,(2018) Supreme Court of India,Supreme Court judgment. Query category: property dispute land acquisition.,True,indiankanoon.org,https://indiankanoon.org/docfragment/41602852/?formInput=property%20dispute%20land%20acquisition%20%20doctypes%3A%20supremecourt
People'S Union Of Civil Liberties ... vs Union Of India & Anr,2003,(2003) Supreme Court of India,Supreme Court judgment. Query category: constitutional validity fundamental rights.,True,indiankanoon.org,https://indiankanoon.org/docfragment/15059075/?formInput=constitutional%20validity%20fundamental%20rights%20%20doctypes%3A%20supremecourt
Ishwari Lal Yadav vs State Of Chhattisgarh,2019,(2019) Supreme Court of India,Supreme Court judgment. Query category: criminal appeal conviction sentence.,True,indiankanoon.org,https://indiankanoon.org/docfragment/51591697/?formInput=criminal%20appeal%20conviction%20sentence%20%20doctypes%3A%20supremecourt
Rashmi Ajay Kr.Kesharwani vs Ajay Kr.Kesharwani And Ors,2012,(2012) Supreme Court of India,Supreme Court judgment. Query category: writ petition habeas corpus.,True,indiankanoon.org,https://indiankanoon.org/docfragment/124591812/?formInput=writ%20petition%20habeas%20corpus%20%20doctypes%3A%20supremecourt
Tech Freedom Initiative v. National Investigation Agency,2015,(2015) 13 SCC 359,"Petition challenging arbitrary internet shutdowns in conflict zones, filed under Article 32 of the Constitution.",False,synthetic-researcher-generated,N/A
Mahmadhusen Abdulrahim Kalota Shaikh vs Union Of India & Ors,2008,(2008) Supreme Court of India,Supreme Court judgment. Query category: constitutional validity fundamental rights.,True,indiankanoon.org,https://indiankanoon.org/docfragment/342033/?formInput=constitutional%20validity%20fundamental%20rights%20%20doctypes%3A%20supremecourt
Vineeta Sharma vs Rakesh Sharma,2020,(2020) Supreme Court of India,Supreme Court judgment. Query category: property dispute land acquisition.,True,indiankanoon.org,https://indiankanoon.org/docfragment/67965481/?formInput=property%20dispute%20land%20acquisition%20%20doctypes%3A%20supremecourt
Small Traders Federation of India v. State of Karnataka,2013,(2013) 13 SCC 872,"Petition challenging uniform civil code implementation in Goa, filed under Article 32 of the Constitution.",False,synthetic-researcher-generated,N/A
National Parents Association v. State of Delhi,2018,(2018) 10 SCC 161,"Petition challenging anti-defection law interpretation, filed under Article 32 of the Constitution.",False,synthetic-researcher-generated,N/A
Santokh Singh vs Delhi Administration,1973,(1973) Supreme Court of India,Supreme Court judgment. Query category: constitutional validity fundamental rights.,True,indiankanoon.org,https://indiankanoon.org/docfragment/572877/?formInput=constitutional%20validity%20fundamental%20rights%20%20doctypes%3A%20supremecourt
Digital Rights Foundation v. National Highway Authority,2013,(2013) 5 SCC 733,"Petition challenging right to be forgotten in the digital age, filed under Article 32 of the Constitution.",False,synthetic-researcher-generated,N/A
"State Tr.P.S.Lodhi Colony,New Delhi vs Sanjeev Nanda",2012,(2012) Supreme Court of India,Supreme Court judgment. Query category: criminal appeal conviction sentence.,True,indiankanoon.org,https://indiankanoon.org/docfragment/190237958/?formInput=criminal%20appeal%20conviction%20sentence%20%20doctypes%3A%20supremecourt
Consumer Rights Federation v. Reserve Bank of India,2002,(2002) 3 SCC 19,"Petition challenging mandatory biometric attendance in schools, filed under Article 32 of the Constitution.",False,synthetic-researcher-generated,N/A
Digital Rights Foundation v. Reserve Bank of India,2005,(2005) 2 SCC 34,"Petition challenging retrospective environmental clearance for highways, filed under Article 32 of the Constitution.",False,synthetic-researcher-generated,N/A
Internet Freedom Foundation v. State of Karnataka,2000,(2000) 10 SCC 674,"Petition challenging overnight bail restrictions for journalists, filed under Article 32 of the Constitution.",False,synthetic-researcher-generated,N/A
"The State Of West Bengal vs Anwar All Sarkarhabib Mohamed,The ...",1952,(1952) Supreme Court of India,Supreme Court judgment. Query category: constitutional validity fundamental rights.,True,indiankanoon.org,https://indiankanoon.org/docfragment/1270239/?formInput=constitutional%20validity%20fundamental%20rights%20%20doctypes%3A%20supremecourt
Internet Freedom Foundation v. State of West Bengal,2018,(2018) 6 SCC 463,"Petition challenging mandatory COVID-19 vaccination policy, filed under Article 32 of the Constitution.",False,synthetic-researcher-generated,N/A
The Home Secretary (Prison) vs H. Nilofer Nisha,2020,(2020) Supreme Court of India,Supreme Court judgment. Query category: writ petition habeas corpus.,True,indiankanoon.org,https://indiankanoon.org/docfragment/7964850/?formInput=writ%20petition%20habeas%20corpus%20%20doctypes%3A%20supremecourt
Surya Vadanan vs State Of Tamilnadu & Ors,2015,(2015) Supreme Court of India,Supreme Court judgment. Query category: writ petition habeas corpus.,True,indiankanoon.org,https://indiankanoon.org/docfragment/85436368/?formInput=writ%20petition%20habeas%20corpus%20%20doctypes%3A%20supremecourt
Consumer Rights Federation v. Department of Telecommunications,2018,(2018) 13 SCC 947,"Petition challenging right to be forgotten in the digital age, filed under Article 32 of the Constitution.",False,synthetic-researcher-generated,N/A
Dayal Singh & Ors vs Union Of India & Ors,2003,(2003) Supreme Court of India,Supreme Court judgment. Query category: property dispute land acquisition.,True,indiankanoon.org,https://indiankanoon.org/docfragment/876341/?formInput=property%20dispute%20land%20acquisition%20%20doctypes%3A%20supremecourt
Union Of India & Ors vs Shiv Raj & Ors,2014,(2014) Supreme Court of India,Supreme Court judgment. Query category: property dispute land acquisition.,True,indiankanoon.org,https://indiankanoon.org/docfragment/120765903/?formInput=property%20dispute%20land%20acquisition%20%20doctypes%3A%20supremecourt
"R.K.Anand vs Registrar,Delhi High Court",2009,(2009) Supreme Court of India,Supreme Court judgment. Query category: writ petition habeas corpus.,True,indiankanoon.org,https://indiankanoon.org/docfragment/58440/?formInput=writ%20petition%20habeas%20corpus%20%20doctypes%3A%20supremecourt
People`S Union For Civilliberties ... vs The Union Of India And Another,1996,(1996) Supreme Court of India,Supreme Court judgment. Query category: article 21 right to life liberty.,True,indiankanoon.org,https://indiankanoon.org/docfragment/973841/?formInput=article%2021%20right%20to%20life%20liberty%20%20doctypes%3A%20supremecourt
Urban Residents Welfare Board v. National Investigation Agency,2014,(2014) 2 SCC 373,"Petition challenging sedition charges against students, filed under Article 32 of the Constitution.",False,synthetic-researcher-generated,N/A
Healthcare Workers Union v. Central Bureau of Investigation,2010,(2010) 5 SCC 900,"Petition challenging digital surveillance by intelligence agencies, filed under Article 32 of the Constitution.",False,synthetic-researcher-generated,N/A
"Mohinuddin @ Moin Master vs District Magistrate, Beed & Ors",1987,(1987) Supreme Court of India,Supreme Court judgment. Query category: writ petition habeas corpus.,True,indiankanoon.org,https://indiankanoon.org/docfragment/655138/?formInput=writ%20petition%20habeas%20corpus%20%20doctypes%3A%20supremecourt
Association of Democratic Reforms v. Central Bureau of Investigation,2003,(2003) 11 SCC 307,"Petition challenging anti-defection law interpretation, filed under Article 32 of the Constitution.",False,synthetic-researcher-generated,N/A
Indian Civil Liberties Union v. State of Uttar Pradesh,2020,(2020) 1 SCC 826,"Petition challenging right to water as a fundamental right, filed under Article 32 of the Constitution.",False,synthetic-researcher-generated,N/A
Association of Democratic Reforms v. Food Corporation of India,2016,(2016) 2 SCC 807,"Petition challenging overnight bail restrictions for journalists, filed under Article 32 of the Constitution.",False,synthetic-researcher-generated,N/A
"Sapmawia vs Deputy Commissioner, Aijal",1970,(1970) Supreme Court of India,Supreme Court judgment. Query category: writ petition habeas corpus.,True,indiankanoon.org,https://indiankanoon.org/docfragment/330105/?formInput=writ%20petition%20habeas%20corpus%20%20doctypes%3A%20supremecourt
Gujarat Steel Tubes Ltd vs Gujarat Steel Tubes Mazdoor Sabha,1979,(1979) Supreme Court of India,Supreme Court judgment. Query category: service law government employment.,True,indiankanoon.org,https://indiankanoon.org/docfragment/609478/?formInput=service%20law%20government%20employment%20%20doctypes%3A%20supremecourt
State Of Punjab And Anr vs Khan Chand,1973,(1973) Supreme Court of India,Supreme Court judgment. Query category: constitutional validity fundamental rights.,True,indiankanoon.org,https://indiankanoon.org/docfragment/1113423/?formInput=constitutional%20validity%20fundamental%20rights%20%20doctypes%3A%20supremecourt
Tech Freedom Initiative v. State of Maharashtra,2003,(2003) 12 SCC 864,"Petition challenging hate speech regulation on social media, filed under Article 32 of the Constitution.",False,synthetic-researcher-generated,N/A
Harjinder Singh vs Punjab State Warehousing Corp,2010,(2010) Supreme Court of India,Supreme Court judgment. Query category: service law government employment.,True,indiankanoon.org,https://indiankanoon.org/docfragment/1613762/?formInput=service%20law%20government%20employment%20%20doctypes%3A%20supremecourt
I.C. Golak Nath And Ors. vs State Of Punjab And Anr.,1967,(1967) Supreme Court of India,Supreme Court judgment. Query category: constitutional validity fundamental rights.,True,indiankanoon.org,https://indiankanoon.org/docfragment/21266288/?formInput=constitutional%20validity%20fundamental%20rights%20%20doctypes%3A%20supremecourt
Urban Residents Welfare Board v. Reserve Bank of India,2016,(2016) 16 SCC 502,"Petition challenging mandatory biometric attendance in schools, filed under Article 32 of the Constitution.",False,synthetic-researcher-generated,N/A
Sardar Syedna Taher Saifuddin Saheb vs The State Of Bombay,1962,(1962) Supreme Court of India,Supreme Court judgment. Query category: constitutional validity fundamental rights.,True,indiankanoon.org,https://indiankanoon.org/docfragment/510078/?formInput=constitutional%20validity%20fundamental%20rights%20%20doctypes%3A%20supremecourt
E. P. Royappa vs State Of Tamil Nadu & Anr,1973,(1973) Supreme Court of India,Supreme Court judgment. Query category: service law government employment.,True,indiankanoon.org,https://indiankanoon.org/docfragment/1327287/?formInput=service%20law%20government%20employment%20%20doctypes%3A%20supremecourt
"Ajit Mohan vs Legislative Assembly, National ...",2021,(2021) Supreme Court of India,Supreme Court judgment. Query category: constitutional validity fundamental rights.,True,indiankanoon.org,https://indiankanoon.org/docfragment/23436105/?formInput=constitutional%20validity%20fundamental%20rights%20%20doctypes%3A%20supremecourt
Tejaswini Gaud vs Shekhar Jagdish Prasad Tewari,2019,(2019) Supreme Court of India,Supreme Court judgment. Query category: writ petition habeas corpus.,True,indiankanoon.org,https://indiankanoon.org/docfragment/184268381/?formInput=writ%20petition%20habeas%20corpus%20%20doctypes%3A%20supremecourt
Union Of India vs Nihar Kanta Sen & Ors,1987,(1987) Supreme Court of India,Supreme Court judgment. Query category: property dispute land acquisition.,True,indiankanoon.org,https://indiankanoon.org/docfragment/919234/?formInput=property%20dispute%20land%20acquisition%20%20doctypes%3A%20supremecourt
R.P. Kapur vs Pratap Singh Kairon And Others,1961,(1961) Supreme Court of India,Supreme Court judgment. Query category: service law government employment.,True,indiankanoon.org,https://indiankanoon.org/docfragment/1477774/?formInput=service%20law%20government%20employment%20%20doctypes%3A%20supremecourt
All India Women's Rights Council v. Food Corporation of India,2017,(2017) 14 SCC 801,"Petition challenging mandatory COVID-19 vaccination policy, filed under Article 32 of the Constitution.",False,synthetic-researcher-generated,N/A
Society For Un-Aided P.School Of Raj vs U.O.I & Anr,2012,(2012) Supreme Court of India,Supreme Court judgment. Query category: constitutional validity fundamental rights.,True,indiankanoon.org,https://indiankanoon.org/docfragment/154958944/?formInput=constitutional%20validity%20fundamental%20rights%20%20doctypes%3A%20supremecourt
Migrant Labour Protection Forum v. State of Uttar Pradesh,2004,(2004) 11 SCC 462,"Petition challenging right to be forgotten in the digital age, filed under Article 32 of the Constitution.",False,synthetic-researcher-generated,N/A
Anokhilal vs The State Of Madhya Pradesh,2019,(2019) Supreme Court of India,Supreme Court judgment. Query category: criminal appeal conviction sentence.,True,indiankanoon.org,https://indiankanoon.org/docfragment/110783225/?formInput=criminal%20appeal%20conviction%20sentence%20%20doctypes%3A%20supremecourt
All India Women's Rights Council v. State of Kerala,2021,(2021) 3 SCC 920,"Petition challenging pension rights for contract government employees, filed under Article 32 of the Constitution.",False,synthetic-researcher-generated,N/A
Rural Development Society v. Ministry of Finance,2014,(2014) 9 SCC 254,"Petition challenging mandatory COVID-19 vaccination policy, filed under Article 32 of the Constitution.",False,synthetic-researcher-generated,N/A
Secretary Irrigation Department ... vs G.C. Roy,1991,(1991) Supreme Court of India,Supreme Court judgment. Query category: property dispute land acquisition.,True,indiankanoon.org,https://indiankanoon.org/docfragment/654172/?formInput=property%20dispute%20land%20acquisition%20%20doctypes%3A%20supremecourt
Raj Pal Singh vs Commissioner Of Income Tax Haryana,2020,(2020) Supreme Court of India,Supreme Court judgment. Query category: property dispute land acquisition.,True,indiankanoon.org,https://indiankanoon.org/docfragment/99337348/?formInput=property%20dispute%20land%20acquisition%20%20doctypes%3A%20supremecourt
Digital Rights Foundation v. Reserve Bank of India,1990,(1990) 1 SCC 240,"Petition challenging right to internet access under Article 21, filed under Article 32 of the Constitution.",False,synthetic-researcher-generated,N/A
Rural Development Society v. State of Karnataka,2014,(2014) 1 SCC 200,"Petition challenging mandatory COVID-19 vaccination policy, filed under Article 32 of the Constitution.",False,synthetic-researcher-generated,N/A
State Of Punjab vs Davinder Pal Singh Bhullar & Ors.Etc,2011,(2011) Supreme Court of India,Supreme Court judgment. Query category: writ petition habeas corpus.,True,indiankanoon.org,https://indiankanoon.org/docfragment/138575974/?formInput=writ%20petition%20habeas%20corpus%20%20doctypes%3A%20supremecourt
All India Women's Rights Council v. State of Tamil Nadu,1997,(1997) 16 SCC 914,"Petition challenging uniform civil code implementation in Goa, filed under Article 32 of the Constitution.",False,synthetic-researcher-generated,N/A
Healthcare Workers Union v. State of West Bengal,2015,(2015) 13 SCC 735,"Petition challenging overnight bail restrictions for journalists, filed under Article 32 of the Constitution.",False,synthetic-researcher-generated,N/A
Indian Civil Liberties Union v. Securities and Exchange Board of India,1995,(1995) 5 SCC 815,"Petition challenging anti-defection law interpretation, filed under Article 32 of the Constitution.",False,synthetic-researcher-generated,N/A
Har Shankar & Ors. Etc. Etc vs The Dy. Excise & Taxation Commr. & Ors,1975,(1975) Supreme Court of India,Supreme Court judgment. Query category: constitutional validity fundamental rights.,True,indiankanoon.org,https://indiankanoon.org/docfragment/1159364/?formInput=constitutional%20validity%20fundamental%20rights%20%20doctypes%3A%20supremecourt
All India Women's Rights Council v. Ministry of Environment,1994,(1994) 3 SCC 712,"Petition challenging farm loan waiver scheme constitutionality, filed under Article 32 of the Constitution.",False,synthetic-researcher-generated,N/A
Small Traders Federation of India v. Ministry of Environment,2011,(2011) 11 SCC 421,"Petition challenging digital surveillance by intelligence agencies, filed under Article 32 of the Constitution.",False,synthetic-researcher-generated,N/A
National Human Rights Commission (Petitioner) v. Ministry of Finance,1991,(1991) 12 SCC 266,"Petition challenging anti-defection law interpretation, filed under Article 32 of the Constitution.",False,synthetic-researcher-generated,N/A
Rural Development Society v. Central Vigilance Commission,1995,(1995) 2 SCC 637,"Petition challenging anti-defection law interpretation, filed under Article 32 of the Constitution.",False,synthetic-researcher-generated,N/A
Rama Meru And Another vs State Of Gujarat,1992,(1992) Supreme Court of India,Supreme Court judgment. Query category: criminal appeal conviction sentence.,True,indiankanoon.org,https://indiankanoon.org/docfragment/1814850/?formInput=criminal%20appeal%20conviction%20sentence%20%20doctypes%3A%20supremecourt
Urban Residents Welfare Board v. Securities and Exchange Board of India,2014,(2014) 8 SCC 136,"Petition challenging digital surveillance by intelligence agencies, filed under Article 32 of the Constitution.",False,synthetic-researcher-generated,N/A
Migrant Labour Protection Forum v. Union of India,1990,(1990) 14 SCC 397,"Petition challenging right to protest in public spaces, filed under Article 32 of the Constitution.",False,synthetic-researcher-generated,N/A
All India Women's Rights Council v. Securities and Exchange Board of India,1997,(1997) 8 SCC 673,"Petition challenging overnight bail restrictions for journalists, filed under Article 32 of the Constitution.",False,synthetic-researcher-generated,N/A
Kishore Samrite vs State Of U.P. & Ors,2012,(2012) Supreme Court of India,Supreme Court judgment. Query category: article 21 right to life liberty.,True,indiankanoon.org,https://indiankanoon.org/docfragment/172073149/?formInput=article%2021%20right%20to%20life%20liberty%20%20doctypes%3A%20supremecourt
Popular Muthiah vs State Represented By Inspector Of ...,2006,(2006) Supreme Court of India,Supreme Court judgment. Query category: criminal appeal conviction sentence.,True,indiankanoon.org,https://indiankanoon.org/docfragment/1241751/?formInput=criminal%20appeal%20conviction%20sentence%20%20doctypes%3A%20supremecourt
Rohith Thammana Gowda vs The State Of Karnataka,2022,(2022) Supreme Court of India,Supreme Court judgment. Query category: writ petition habeas corpus.,True,indiankanoon.org,https://indiankanoon.org/docfragment/174872729/?formInput=writ%20petition%20habeas%20corpus%20%20doctypes%3A%20supremecourt
Consumer Rights Federation v. Ministry of Home Affairs,1992,(1992) 8 SCC 960,"Petition challenging electoral bond scheme transparency, filed under Article 32 of the Constitution.",False,synthetic-researcher-generated,N/A
Ex-Capt. Harish Uppal vs Union Of India & Anr,2002,(2002) Supreme Court of India,Supreme Court judgment. Query category: article 21 right to life liberty.,True,indiankanoon.org,https://indiankanoon.org/docfragment/1292543/?formInput=article%2021%20right%20to%20life%20liberty%20%20doctypes%3A%20supremecourt
Danial Latifi & Anr vs Union Of India,2001,(2001) Supreme Court of India,Supreme Court judgment. Query category: article 21 right to life liberty.,True,indiankanoon.org,https://indiankanoon.org/docfragment/410660/?formInput=article%2021%20right%20to%20life%20liberty%20%20doctypes%3A%20supremecourt
Citizens Forum for Transparency v. State of Maharashtra,2024,(2024) 15 SCC 106,"Petition challenging right to protest in public spaces, filed under Article 32 of the Constitution.",False,synthetic-researcher-generated,N/A
"Kishan Chand Arora vs Commissioner Of Police, Calcutta",1960,(1960) Supreme Court of India,Supreme Court judgment. Query category: constitutional validity fundamental rights.,True,indiankanoon.org,https://indiankanoon.org/docfragment/621247/?formInput=constitutional%20validity%20fundamental%20rights%20%20doctypes%3A%20supremecourt
All India Women's Rights Council v. State of Karnataka,2022,(2022) 11 SCC 405,"Petition challenging pension rights for contract government employees, filed under Article 32 of the Constitution.",False,synthetic-researcher-generated,N/A
Internet Freedom Foundation v. State of Karnataka,1995,(1995) 13 SCC 680,"Petition challenging anti-defection law interpretation, filed under Article 32 of the Constitution.",False,synthetic-researcher-generated,N/A
Tech Freedom Initiative v. Election Commission of India,2021,(2021) 15 SCC 413,"Petition challenging hate speech regulation on social media, filed under Article 32 of the Constitution.",False,synthetic-researcher-generated,N/A
"K.P. Varghese vs The Income Tax Officer,Ernakulam, And ...",1981,(1981) Supreme Court of India,Supreme Court judgment. Query category: constitutional validity fundamental rights.,True,indiankanoon.org,https://indiankanoon.org/docfragment/399708/?formInput=constitutional%20validity%20fundamental%20rights%20%20doctypes%3A%20supremecourt
Dhal Singh Dewangan vs State Of Chhattisgarh,2016,(2016) Supreme Court of India,Supreme Court judgment. Query category: criminal appeal conviction sentence.,True,indiankanoon.org,https://indiankanoon.org/docfragment/162446303/?formInput=criminal%20appeal%20conviction%20sentence%20%20doctypes%3A%20supremecourt
Abp Pvt.Ltd.& Anr vs Union Of India & Ors,2014,(2014) Supreme Court of India,Supreme Court judgment. Query category: constitutional validity fundamental rights.,True,indiankanoon.org,https://indiankanoon.org/docfragment/55355160/?formInput=constitutional%20validity%20fundamental%20rights%20%20doctypes%3A%20supremecourt
State Of Haryana And Ors. Etc. Etc vs Piara Singh And Ors. Etc. Etc,1992,(1992) Supreme Court of India,Supreme Court judgment. Query category: service law government employment.,True,indiankanoon.org,https://indiankanoon.org/docfragment/499423/?formInput=service%20law%20government%20employment%20%20doctypes%3A%20supremecourt
All India Women's Rights Council v. Election Commission of India,1991,(1991) 1 SCC 648,"Petition challenging uniform civil code implementation in Goa, filed under Article 32 of the Constitution.",False,synthetic-researcher-generated,N/A
All India Women's Rights Council v. National Highway Authority,2004,(2004) 11 SCC 235,"Petition challenging hate speech regulation on social media, filed under Article 32 of the Constitution.",False,synthetic-researcher-generated,N/A
Rajeswari Chandrasekar Ganesh vs The State Of Tamil Nadu,2022,(2022) Supreme Court of India,Supreme Court judgment. Query category: writ petition habeas corpus.,True,indiankanoon.org,https://indiankanoon.org/docfragment/64568495/?formInput=writ%20petition%20habeas%20corpus%20%20doctypes%3A%20supremecourt
